{
  "$schema": "https://raw.githubusercontent.com/Naptie/openmetro/main/schemas/v1/lines.schema.json",
  "schema_version": "1.0",
  "network_id": "cn-sh",
  "generated_at": "2026-09-19T20:30:11.252Z",
  "source": [],
  "records": [
    {
      "id": "cn-sh-line-1",
      "name": "1号线",
      "names": {
        "zh": "1号线",
        "en": "Line 1"
      },
      "aliases": [],
      "mode": "metro",
      "status": "operating",
      "loop": false,
      "source_ids": [
        {
          "source": "shmetro-lines",
          "id": "1"
        }
      ],
      "color": "#e3002b",
      "short_name": "1",
      "extras": {
        "names_source": "derived"
      }
    },
    {
      "id": "cn-sh-line-10",
      "name": "10号线",
      "names": {
        "zh": "10号线",
        "en": "Line 10"
      },
      "aliases": [],
      "mode": "metro",
      "status": "operating",
      "loop": false,
      "source_ids": [
        {
          "source": "shmetro-lines",
          "id": "10"
        }
      ],
      "color": "#c6afd4",
      "short_name": "10",
      "extras": {
        "names_source": "derived"
      }
    },
    {
      "id": "cn-sh-line-11",
      "name": "11号线",
      "names": {
        "zh": "11号线",
        "en": "Line 11"
      },
      "aliases": [],
      "mode": "metro",
      "status": "operating",
      "loop": false,
      "source_ids": [
        {
          "source": "shmetro-lines",
          "id": "11"
        }
      ],
      "color": "#871c2b",
      "short_name": "11",
      "extras": {
        "names_source": "derived"
      }
    },
    {
      "id": "cn-sh-line-12",
      "name": "12号线",
      "names": {
        "zh": "12号线",
        "en": "Line 12"
      },
      "aliases": [],
      "mode": "metro",
      "status": "operating",
      "loop": false,
      "source_ids": [
        {
          "source": "shmetro-lines",
          "id": "12"
        }
      ],
      "color": "#007a60",
      "short_name": "12",
      "extras": {
        "names_source": "derived"
      }
    },
    {
      "id": "cn-sh-line-13",
      "name": "13号线",
      "names": {
        "zh": "13号线",
        "en": "Line 13"
      },
      "aliases": [],
      "mode": "metro",
      "status": "operating",
      "loop": false,
      "source_ids": [
        {
          "source": "shmetro-lines",
          "id": "13"
        }
      ],
      "color": "#e999c0",
      "short_name": "13",
      "extras": {
        "names_source": "derived"
      }
    },
    {
      "id": "cn-sh-line-14",
      "name": "14号线",
      "names": {
        "zh": "14号线",
        "en": "Line 14"
      },
      "aliases": [],
      "mode": "metro",
      "status": "operating",
      "loop": false,
      "source_ids": [
        {
          "source": "shmetro-lines",
          "id": "14"
        }
      ],
      "color": "#616020",
      "short_name": "14",
      "extras": {
        "names_source": "derived"
      }
    },
    {
      "id": "cn-sh-line-15",
      "name": "15号线",
      "names": {
        "zh": "15号线",
        "en": "Line 15"
      },
      "aliases": [],
      "mode": "metro",
      "status": "operating",
      "loop": false,
      "source_ids": [
        {
          "source": "shmetro-lines",
          "id": "15"
        }
      ],
      "color": "#c8b38e",
      "short_name": "15",
      "extras": {
        "names_source": "derived"
      }
    },
    {
      "id": "cn-sh-line-16",
      "name": "16号线",
      "names": {
        "zh": "16号线",
        "en": "Line 16"
      },
      "aliases": [],
      "mode": "metro",
      "status": "operating",
      "loop": false,
      "source_ids": [
        {
          "source": "shmetro-lines",
          "id": "16"
        }
      ],
      "color": "#98d1c0",
      "short_name": "16",
      "extras": {
        "names_source": "derived"
      }
    },
    {
      "id": "cn-sh-line-17",
      "name": "17号线",
      "names": {
        "zh": "17号线",
        "en": "Line 17"
      },
      "aliases": [],
      "mode": "metro",
      "status": "operating",
      "loop": false,
      "source_ids": [
        {
          "source": "shmetro-lines",
          "id": "17"
        }
      ],
      "color": "#bb796f",
      "short_name": "17",
      "extras": {
        "names_source": "derived"
      }
    },
    {
      "id": "cn-sh-line-18",
      "name": "18号线",
      "names": {
        "zh": "18号线",
        "en": "Line 18"
      },
      "aliases": [],
      "mode": "metro",
      "status": "operating",
      "loop": false,
      "source_ids": [
        {
          "source": "shmetro-lines",
          "id": "18"
        }
      ],
      "color": "#C09453",
      "short_name": "18",
      "extras": {
        "names_source": "derived"
      }
    },
    {
      "id": "cn-sh-line-2",
      "name": "2号线",
      "names": {
        "zh": "2号线",
        "en": "Line 2"
      },
      "aliases": [],
      "mode": "metro",
      "status": "operating",
      "loop": false,
      "source_ids": [
        {
          "source": "shmetro-lines",
          "id": "2"
        }
      ],
      "color": "#8cc220",
      "short_name": "2",
      "extras": {
        "names_source": "derived"
      }
    },
    {
      "id": "cn-sh-line-3",
      "name": "3号线",
      "names": {
        "zh": "3号线",
        "en": "Line 3"
      },
      "aliases": [],
      "mode": "metro",
      "status": "operating",
      "loop": false,
      "source_ids": [
        {
          "source": "shmetro-lines",
          "id": "3"
        }
      ],
      "color": "#fcd600",
      "short_name": "3",
      "extras": {
        "names_source": "derived"
      }
    },
    {
      "id": "cn-sh-line-4",
      "name": "4号线",
      "names": {
        "zh": "4号线",
        "en": "Line 4"
      },
      "aliases": [],
      "mode": "metro",
      "status": "operating",
      "loop": true,
      "source_ids": [
        {
          "source": "shmetro-lines",
          "id": "4"
        }
      ],
      "color": "#461d84",
      "short_name": "4",
      "extras": {
        "names_source": "derived"
      }
    },
    {
      "id": "cn-sh-line-41",
      "name": "浦江线",
      "names": {
        "zh": "浦江线",
        "en": "Pujiang Line"
      },
      "aliases": [],
      "mode": "suburban_rail",
      "status": "operating",
      "loop": false,
      "source_ids": [
        {
          "source": "shmetro-lines",
          "id": "41"
        }
      ],
      "color": "#b5b6b6",
      "short_name": "浦江线",
      "extras": {
        "names_source": "derived"
      }
    },
    {
      "id": "cn-sh-line-5",
      "name": "5号线",
      "names": {
        "zh": "5号线",
        "en": "Line 5"
      },
      "aliases": [],
      "mode": "metro",
      "status": "operating",
      "loop": false,
      "source_ids": [
        {
          "source": "shmetro-lines",
          "id": "5"
        }
      ],
      "color": "#944d9a",
      "short_name": "5",
      "extras": {
        "names_source": "derived"
      }
    },
    {
      "id": "cn-sh-line-51",
      "name": "市域机场线",
      "names": {
        "zh": "市域机场线",
        "en": "Airport Link Line"
      },
      "aliases": [],
      "mode": "suburban_rail",
      "status": "operating",
      "loop": false,
      "source_ids": [
        {
          "source": "shmetro-lines",
          "id": "51"
        }
      ],
      "color": "#cccccc",
      "short_name": "市域机场线",
      "extras": {
        "names_source": "derived"
      }
    },
    {
      "id": "cn-sh-line-6",
      "name": "6号线",
      "names": {
        "zh": "6号线",
        "en": "Line 6"
      },
      "aliases": [],
      "mode": "metro",
      "status": "operating",
      "loop": false,
      "source_ids": [
        {
          "source": "shmetro-lines",
          "id": "6"
        }
      ],
      "color": "#d40068",
      "short_name": "6",
      "extras": {
        "names_source": "derived"
      }
    },
    {
      "id": "cn-sh-line-7",
      "name": "7号线",
      "names": {
        "zh": "7号线",
        "en": "Line 7"
      },
      "aliases": [],
      "mode": "metro",
      "status": "operating",
      "loop": false,
      "source_ids": [
        {
          "source": "shmetro-lines",
          "id": "7"
        }
      ],
      "color": "#ed6f00",
      "short_name": "7",
      "extras": {
        "names_source": "derived"
      }
    },
    {
      "id": "cn-sh-line-8",
      "name": "8号线",
      "names": {
        "zh": "8号线",
        "en": "Line 8"
      },
      "aliases": [],
      "mode": "metro",
      "status": "operating",
      "loop": false,
      "source_ids": [
        {
          "source": "shmetro-lines",
          "id": "8"
        }
      ],
      "color": "#0094d8",
      "short_name": "8",
      "extras": {
        "names_source": "derived"
      }
    },
    {
      "id": "cn-sh-line-9",
      "name": "9号线",
      "names": {
        "zh": "9号线",
        "en": "Line 9"
      },
      "aliases": [],
      "mode": "metro",
      "status": "operating",
      "loop": false,
      "source_ids": [
        {
          "source": "shmetro-lines",
          "id": "9"
        }
      ],
      "color": "#87caed",
      "short_name": "9",
      "extras": {
        "names_source": "derived"
      }
    }
  ]
}