{
  "$schema": "https://raw.githubusercontent.com/Naptie/openmetro/main/schemas/v1/lines.schema.json",
  "schema_version": "1.0",
  "network_id": "cn-shenyang",
  "generated_at": "2026-10-22T20:20:25.060Z",
  "source": [],
  "records": [
    {
      "id": "cn-shenyang-line-1",
      "name": "1号线",
      "names": {
        "zh": "1号线",
        "en": "Line 1"
      },
      "aliases": [],
      "color": "#cf3517",
      "short_name": "1",
      "mode": "metro",
      "status": "operating",
      "loop": false,
      "source_ids": [
        {
          "source": "symtc-cocc-api",
          "id": "01"
        },
        {
          "source": "amap-subway-2101",
          "id": "210100020752|210100020753"
        }
      ],
      "extras": {
        "official_line_id": "01",
        "line_mileage_km": "43",
        "station_count": "32",
        "opened_at": "2010-09-27",
        "closes_at": "2999-12-31",
        "amap_color": "FC0601",
        "baidu_name_hint": "地铁1号线"
      }
    },
    {
      "id": "cn-shenyang-line-10",
      "name": "10号线",
      "names": {
        "zh": "10号线",
        "en": "Subway Line 10"
      },
      "aliases": [],
      "color": "#80b72e",
      "short_name": "10",
      "mode": "metro",
      "status": "operating",
      "loop": false,
      "source_ids": [
        {
          "source": "symtc-cocc-api",
          "id": "10"
        },
        {
          "source": "amap-subway-2101",
          "id": "900000039634|900000039635"
        }
      ],
      "extras": {
        "official_line_id": "10",
        "line_mileage_km": "27",
        "station_count": "21",
        "opened_at": "2020-04-29",
        "closes_at": "2999-12-31",
        "amap_color": "6CB46B",
        "baidu_name_hint": "地铁10号线"
      }
    },
    {
      "id": "cn-shenyang-line-2",
      "name": "2号线",
      "names": {
        "zh": "2号线",
        "en": "Line 2"
      },
      "aliases": [],
      "color": "#ee782d",
      "short_name": "2",
      "mode": "metro",
      "status": "operating",
      "loop": false,
      "source_ids": [
        {
          "source": "symtc-cocc-api",
          "id": "02"
        },
        {
          "source": "amap-subway-2101",
          "id": "210100020748|210100020749"
        }
      ],
      "extras": {
        "official_line_id": "02",
        "line_mileage_km": "47",
        "station_count": "33",
        "opened_at": "2011-12-30",
        "closes_at": "2999-12-31",
        "amap_color": "EE782E",
        "baidu_name_hint": "地铁2号线"
      }
    },
    {
      "id": "cn-shenyang-line-3",
      "name": "3号线",
      "names": {
        "zh": "3号线",
        "en": "Line 3"
      },
      "aliases": [],
      "color": "#e668a0",
      "short_name": "3",
      "mode": "metro",
      "status": "operating",
      "loop": false,
      "source_ids": [
        {
          "source": "symtc-cocc-api",
          "id": "03"
        },
        {
          "source": "amap-subway-2101",
          "id": "900000095078|900000095079"
        }
      ],
      "extras": {
        "official_line_id": "03",
        "line_mileage_km": "36",
        "station_count": "27",
        "opened_at": "2024-12-30",
        "closes_at": "2999-12-31",
        "amap_color": "EB81B9",
        "baidu_name_hint": "地铁3号线"
      }
    },
    {
      "id": "cn-shenyang-line-4",
      "name": "4号线",
      "names": {
        "zh": "4号线",
        "en": "Line 4"
      },
      "aliases": [],
      "color": "#6f3d94",
      "short_name": "4",
      "mode": "metro",
      "status": "operating",
      "loop": false,
      "source_ids": [
        {
          "source": "symtc-cocc-api",
          "id": "04"
        },
        {
          "source": "amap-subway-2101",
          "id": "900000071786|900000071787"
        }
      ],
      "extras": {
        "official_line_id": "04",
        "line_mileage_km": "33",
        "station_count": "23",
        "opened_at": "2023-09-29",
        "closes_at": "2999-12-31",
        "amap_color": "793E8C",
        "baidu_name_hint": "地铁4号线"
      }
    },
    {
      "id": "cn-shenyang-line-9",
      "name": "9号线",
      "names": {
        "zh": "9号线",
        "en": "Line 9"
      },
      "aliases": [],
      "color": "#008dd0",
      "short_name": "9",
      "mode": "metro",
      "status": "operating",
      "loop": false,
      "source_ids": [
        {
          "source": "symtc-cocc-api",
          "id": "09"
        },
        {
          "source": "amap-subway-2101",
          "id": "900000039632|900000039633"
        }
      ],
      "extras": {
        "official_line_id": "09",
        "line_mileage_km": "29",
        "station_count": "23",
        "opened_at": "2019-05-25",
        "closes_at": "2999-12-31",
        "amap_color": "027CFF",
        "baidu_name_hint": "地铁9号线"
      }
    }
  ]
}