{
  "$schema": "https://raw.githubusercontent.com/Naptie/openmetro/main/schemas/v1/lines.schema.json",
  "schema_version": "1.0",
  "network_id": "cn-xian",
  "generated_at": "2026-09-26T06:25:25.605Z",
  "source": [],
  "records": [
    {
      "id": "cn-xian-line-1",
      "name": "地铁1号线",
      "names": {
        "zh": "地铁1号线",
        "en": "Line 1"
      },
      "aliases": [],
      "color": "#01a2e2",
      "short_name": "1",
      "mode": "metro",
      "status": "operating",
      "loop": false,
      "source_ids": [
        {
          "source": "xianrail-pas-gateway",
          "id": "01"
        },
        {
          "source": "amap-subway-6101",
          "id": "610100020728"
        }
      ],
      "extras": {
        "official_line_length_km": 30.867,
        "amap_color": "01A2E2",
        "line_type": "1"
      }
    },
    {
      "id": "cn-xian-line-10",
      "name": "地铁10号线",
      "names": {
        "zh": "地铁10号线",
        "en": "Line 10"
      },
      "aliases": [],
      "color": "#00ab4f",
      "short_name": "10",
      "mode": "metro",
      "status": "operating",
      "loop": false,
      "source_ids": [
        {
          "source": "xianrail-pas-gateway",
          "id": "10"
        },
        {
          "source": "amap-subway-6101",
          "id": "900000145392"
        }
      ],
      "extras": {
        "amap_color": "00AB4F",
        "line_type": "1"
      }
    },
    {
      "id": "cn-xian-line-14",
      "name": "地铁14号线",
      "names": {
        "zh": "地铁14号线",
        "en": "Line 14"
      },
      "aliases": [],
      "color": "#019ac3",
      "short_name": "14",
      "mode": "metro",
      "status": "operating",
      "loop": false,
      "source_ids": [
        {
          "source": "xianrail-pas-gateway",
          "id": "14"
        },
        {
          "source": "amap-subway-6101",
          "id": "900000076251"
        }
      ],
      "extras": {
        "official_line_length_km": 42.208,
        "amap_color": "019AC3",
        "line_type": "1"
      }
    },
    {
      "id": "cn-xian-line-15",
      "name": "地铁15号线",
      "names": {
        "zh": "地铁15号线",
        "en": "Line 15"
      },
      "aliases": [],
      "color": "#ea6183",
      "short_name": "15",
      "mode": "metro",
      "status": "operating",
      "loop": false,
      "source_ids": [
        {
          "source": "xianrail-pas-gateway",
          "id": "15"
        },
        {
          "source": "amap-subway-6101",
          "id": "900000159340"
        }
      ],
      "extras": {
        "amap_color": "EA6183",
        "line_type": "1"
      }
    },
    {
      "id": "cn-xian-line-16",
      "name": "地铁16号线",
      "names": {
        "zh": "地铁16号线",
        "en": "Line 16"
      },
      "aliases": [],
      "color": "#ec8464",
      "short_name": "16",
      "mode": "metro",
      "status": "operating",
      "loop": false,
      "source_ids": [
        {
          "source": "xianrail-pas-gateway",
          "id": "16"
        },
        {
          "source": "amap-subway-6101",
          "id": "900000151628"
        }
      ],
      "extras": {
        "amap_color": "EC8464",
        "line_type": "1"
      }
    },
    {
      "id": "cn-xian-line-2",
      "name": "地铁2号线",
      "names": {
        "zh": "地铁2号线",
        "en": "Line 2"
      },
      "aliases": [],
      "color": "#fc0601",
      "short_name": "2",
      "mode": "metro",
      "status": "operating",
      "loop": false,
      "source_ids": [
        {
          "source": "xianrail-pas-gateway",
          "id": "02"
        },
        {
          "source": "amap-subway-6101",
          "id": "610100021499"
        }
      ],
      "extras": {
        "official_line_length_km": 26.133,
        "amap_color": "FC0601",
        "line_type": "1"
      }
    },
    {
      "id": "cn-xian-line-3",
      "name": "地铁3号线",
      "names": {
        "zh": "地铁3号线",
        "en": "Line 3"
      },
      "aliases": [],
      "color": "#b97caf",
      "short_name": "3",
      "mode": "metro",
      "status": "operating",
      "loop": false,
      "source_ids": [
        {
          "source": "xianrail-pas-gateway",
          "id": "03"
        },
        {
          "source": "amap-subway-6101",
          "id": "610100020611"
        }
      ],
      "extras": {
        "official_line_length_km": 38.032,
        "amap_color": "B97CAF",
        "line_type": "1"
      }
    },
    {
      "id": "cn-xian-line-4",
      "name": "地铁4号线",
      "names": {
        "zh": "地铁4号线",
        "en": "Line 4"
      },
      "aliases": [],
      "color": "#00ad8e",
      "short_name": "4",
      "mode": "metro",
      "status": "operating",
      "loop": false,
      "source_ids": [
        {
          "source": "xianrail-pas-gateway",
          "id": "04"
        },
        {
          "source": "amap-subway-6101",
          "id": "610100020613"
        }
      ],
      "extras": {
        "official_line_length_km": 34.431,
        "amap_color": "00AD8E",
        "line_type": "1"
      }
    },
    {
      "id": "cn-xian-line-5",
      "name": "地铁5号线",
      "names": {
        "zh": "地铁5号线",
        "en": "Line 5"
      },
      "aliases": [],
      "color": "#86b81c",
      "short_name": "5",
      "mode": "metro",
      "status": "operating",
      "loop": false,
      "source_ids": [
        {
          "source": "xianrail-pas-gateway",
          "id": "05"
        },
        {
          "source": "amap-subway-6101",
          "id": "900000074025"
        }
      ],
      "extras": {
        "official_line_length_km": 44.596,
        "amap_color": "86B81C",
        "line_type": "1"
      }
    },
    {
      "id": "cn-xian-line-6",
      "name": "地铁6号线",
      "names": {
        "zh": "地铁6号线",
        "en": "Line 6"
      },
      "aliases": [],
      "color": "#786daf",
      "short_name": "6",
      "mode": "metro",
      "status": "operating",
      "loop": false,
      "source_ids": [
        {
          "source": "xianrail-pas-gateway",
          "id": "06"
        },
        {
          "source": "amap-subway-6101",
          "id": "610100020621"
        }
      ],
      "extras": {
        "official_line_length_km": 39.253,
        "amap_color": "786DAF",
        "line_type": "1"
      }
    },
    {
      "id": "cn-xian-line-8",
      "name": "地铁8号线",
      "names": {
        "zh": "地铁8号线",
        "en": "Line 8"
      },
      "aliases": [],
      "color": "#ffa500",
      "short_name": "8",
      "mode": "metro",
      "status": "operating",
      "loop": true,
      "source_ids": [
        {
          "source": "xianrail-pas-gateway",
          "id": "08"
        },
        {
          "source": "amap-subway-6101",
          "id": "900000131714"
        }
      ],
      "extras": {
        "amap_color": "FFA500",
        "line_type": "1"
      }
    },
    {
      "id": "cn-xian-line-9",
      "name": "地铁9号线",
      "names": {
        "zh": "地铁9号线",
        "en": "Line 9"
      },
      "aliases": [],
      "color": "#ee782e",
      "short_name": "9",
      "mode": "metro",
      "status": "operating",
      "loop": false,
      "source_ids": [
        {
          "source": "xianrail-pas-gateway",
          "id": "09"
        },
        {
          "source": "amap-subway-6101",
          "id": "900000074587"
        }
      ],
      "extras": {
        "official_line_length_km": 24.434,
        "amap_color": "EE782E",
        "line_type": "1"
      }
    },
    {
      "id": "cn-xian-line-xihu",
      "name": "西户线",
      "names": {
        "zh": "西户线",
        "en": "Xihu Line"
      },
      "aliases": [],
      "short_name": "西户线",
      "mode": "suburban_rail",
      "status": "operating",
      "loop": false,
      "source_ids": [
        {
          "source": "xianrail-pas-gateway",
          "id": "50"
        }
      ],
      "extras": {
        "line_type": "1"
      }
    }
  ]
}