{
  "$schema": "https://raw.githubusercontent.com/Naptie/openmetro/main/schemas/v1/lines.schema.json",
  "schema_version": "1.0",
  "network_id": "cn-jinan",
  "generated_at": "2026-10-12T11:11:04.025Z",
  "source": [],
  "records": [
    {
      "id": "cn-jinan-line-1",
      "name": "1号线",
      "names": {
        "zh": "1号线",
        "en": "Line 1"
      },
      "aliases": [
        "轨道交通1号线"
      ],
      "color": "#d10195",
      "short_name": "1",
      "mode": "metro",
      "status": "operating",
      "loop": false,
      "source_ids": [
        {
          "source": "amap-subway-3701",
          "id": "1号线"
        },
        {
          "source": "amap-subway-3701",
          "id": "900000071030"
        },
        {
          "source": "amap-subway-3701",
          "id": "900000071031"
        }
      ],
      "extras": {
        "names_source": "source",
        "amap_color": "D10195",
        "amap_name": "1号线",
        "baidu_vehicle_name": "地铁1号线",
        "fare_policy": "mileage",
        "service_note": "往工研院方向每周五、六、日延长运营（末班约+30分钟）"
      }
    },
    {
      "id": "cn-jinan-line-2",
      "name": "2号线",
      "names": {
        "zh": "2号线",
        "en": "Line 2"
      },
      "aliases": [
        "轨道交通2号线"
      ],
      "color": "#ffa500",
      "short_name": "2",
      "mode": "metro",
      "status": "operating",
      "loop": false,
      "source_ids": [
        {
          "source": "amap-subway-3701",
          "id": "2号线"
        },
        {
          "source": "amap-subway-3701",
          "id": "900000073474"
        },
        {
          "source": "amap-subway-3701",
          "id": "900000073475"
        }
      ],
      "extras": {
        "names_source": "source",
        "amap_color": "FFA500",
        "amap_name": "2号线",
        "baidu_vehicle_name": "地铁2号线",
        "fare_policy": "mileage"
      }
    },
    {
      "id": "cn-jinan-line-3",
      "name": "3号线",
      "names": {
        "zh": "3号线",
        "en": "Line 3"
      },
      "aliases": [
        "轨道交通3号线"
      ],
      "color": "#2249a3",
      "short_name": "3",
      "mode": "metro",
      "status": "operating",
      "loop": false,
      "source_ids": [
        {
          "source": "amap-subway-3701",
          "id": "3号线"
        },
        {
          "source": "amap-subway-3701",
          "id": "900000066599"
        },
        {
          "source": "amap-subway-3701",
          "id": "900000066622"
        }
      ],
      "extras": {
        "names_source": "source",
        "amap_color": "2249A3",
        "amap_name": "3号线",
        "baidu_vehicle_name": "地铁3号线",
        "fare_policy": "mileage"
      }
    },
    {
      "id": "cn-jinan-line-4",
      "name": "4号线",
      "names": {
        "zh": "4号线",
        "en": "Line 4"
      },
      "aliases": [
        "轨道交通4号线"
      ],
      "color": "#018237",
      "short_name": "4",
      "mode": "metro",
      "status": "operating",
      "loop": false,
      "source_ids": [
        {
          "source": "amap-subway-3701",
          "id": "4号线"
        },
        {
          "source": "amap-subway-3701",
          "id": "900000217582"
        },
        {
          "source": "amap-subway-3701",
          "id": "900000217584"
        }
      ],
      "extras": {
        "names_source": "source",
        "amap_color": "018237",
        "amap_name": "4号线",
        "baidu_vehicle_name": "地铁4号线",
        "fare_policy": "mileage"
      }
    },
    {
      "id": "cn-jinan-line-6",
      "name": "6号线",
      "names": {
        "zh": "6号线",
        "en": "Line 6"
      },
      "aliases": [
        "轨道交通6号线"
      ],
      "color": "#02b6e3",
      "short_name": "6",
      "mode": "metro",
      "status": "operating",
      "loop": false,
      "source_ids": [
        {
          "source": "amap-subway-3701",
          "id": "6号线"
        },
        {
          "source": "amap-subway-3701",
          "id": "900000217623"
        },
        {
          "source": "amap-subway-3701",
          "id": "900000217624"
        }
      ],
      "extras": {
        "names_source": "source",
        "amap_color": "02B6E3",
        "amap_name": "6号线",
        "baidu_vehicle_name": "地铁6号线",
        "fare_policy": "mileage"
      }
    },
    {
      "id": "cn-jinan-line-8",
      "name": "8号线",
      "names": {
        "zh": "8号线",
        "en": "Line 8"
      },
      "aliases": [
        "轨道交通8号线"
      ],
      "color": "#5a2b8d",
      "short_name": "8",
      "mode": "metro",
      "status": "operating",
      "loop": false,
      "source_ids": [
        {
          "source": "amap-subway-3701",
          "id": "8号线"
        },
        {
          "source": "amap-subway-3701",
          "id": "900000217676"
        },
        {
          "source": "amap-subway-3701",
          "id": "900000217679"
        }
      ],
      "extras": {
        "names_source": "source",
        "amap_color": "5A2B8D",
        "amap_name": "8号线",
        "baidu_vehicle_name": "地铁8号线",
        "fare_policy": "mileage",
        "through_run_with": "4/8",
        "service_note": "往清源大街方向每周五至周日延长运营（末班约+25分钟）"
      }
    },
    {
      "id": "cn-jinan-line-jy",
      "name": "济阳线",
      "names": {
        "zh": "济阳线",
        "en": "Jiyang Line"
      },
      "aliases": [
        "轨道交通济阳线"
      ],
      "color": "#98d1c0",
      "short_name": "JY",
      "mode": "suburban_rail",
      "status": "operating",
      "loop": false,
      "source_ids": [
        {
          "source": "amap-subway-3701",
          "id": "济阳线"
        },
        {
          "source": "amap-subway-3701",
          "id": "900000235482"
        },
        {
          "source": "amap-subway-3701",
          "id": "900000235483"
        }
      ],
      "extras": {
        "names_source": "source",
        "amap_color": "98D1C0",
        "amap_name": "济阳线",
        "baidu_vehicle_name": "地铁济阳线",
        "fare_policy": "flat2"
      }
    },
    {
      "id": "cn-jinan-line-yb",
      "name": "云巴线",
      "names": {
        "zh": "云巴线",
        "en": "SkyShuttle Line"
      },
      "aliases": [
        "云巴1号线"
      ],
      "color": "#3080b7",
      "short_name": "YB",
      "mode": "monorail",
      "status": "operating",
      "loop": true,
      "source_ids": [
        {
          "source": "amap-subway-3701",
          "id": "云巴1号线"
        },
        {
          "source": "amap-subway-3701",
          "id": "900000235330"
        },
        {
          "source": "amap-subway-3701",
          "id": "900000235331"
        }
      ],
      "extras": {
        "names_source": "source",
        "amap_color": "3080B7",
        "amap_name": "云巴1号线",
        "baidu_vehicle_name": "云巴1号线",
        "fare_policy": "mileage"
      }
    }
  ]
}