{
  "$schema": "https://raw.githubusercontent.com/Naptie/openmetro/main/schemas/v1/lines.schema.json",
  "schema_version": "1.0",
  "network_id": "cn-suzhou",
  "generated_at": "2026-10-12T11:17:29.444Z",
  "source": [],
  "records": [
    {
      "id": "cn-suzhou-line-1",
      "name": "1号线",
      "names": {
        "zh": "1号线",
        "en": "Line 1"
      },
      "aliases": [],
      "mode": "metro",
      "status": "operating",
      "loop": false,
      "color": "#78be20",
      "short_name": "1",
      "source_ids": [
        {
          "source": "sz-mtr-map-js",
          "id": "1"
        }
      ],
      "extras": {
        "source_line_index": 2,
        "names_source": "source",
        "is_extension_corridor": false
      }
    },
    {
      "id": "cn-suzhou-line-10",
      "name": "10号线",
      "names": {
        "zh": "10号线",
        "en": "Line 10"
      },
      "aliases": [],
      "mode": "metro",
      "status": "under_construction",
      "loop": false,
      "short_name": "10",
      "source_ids": [
        {
          "source": "sz-mtr-map-js",
          "id": "10"
        }
      ],
      "extras": {
        "source_line_index": 0,
        "names_source": "source",
        "is_extension_corridor": false
      }
    },
    {
      "id": "cn-suzhou-line-11",
      "name": "11号线",
      "names": {
        "zh": "11号线",
        "en": "Line 11"
      },
      "aliases": [],
      "mode": "metro",
      "status": "operating",
      "loop": false,
      "color": "#f1c6a7",
      "short_name": "11",
      "source_ids": [
        {
          "source": "sz-mtr-map-js",
          "id": "11"
        }
      ],
      "extras": {
        "source_line_index": 9,
        "names_source": "source",
        "is_extension_corridor": false
      }
    },
    {
      "id": "cn-suzhou-line-2",
      "name": "2号线",
      "names": {
        "zh": "2号线",
        "en": "Line 2"
      },
      "aliases": [],
      "mode": "metro",
      "status": "operating",
      "loop": false,
      "color": "#ef3340",
      "short_name": "2",
      "source_ids": [
        {
          "source": "sz-mtr-map-js",
          "id": "2"
        }
      ],
      "extras": {
        "source_line_index": 3,
        "names_source": "source",
        "is_extension_corridor": false
      }
    },
    {
      "id": "cn-suzhou-line-3",
      "name": "3号线",
      "names": {
        "zh": "3号线",
        "en": "Line 3"
      },
      "aliases": [],
      "mode": "metro",
      "status": "operating",
      "loop": false,
      "color": "#ff8200",
      "short_name": "3",
      "source_ids": [
        {
          "source": "sz-mtr-map-js",
          "id": "3"
        }
      ],
      "extras": {
        "source_line_index": 4,
        "names_source": "source",
        "is_extension_corridor": false
      }
    },
    {
      "id": "cn-suzhou-line-4",
      "name": "4号线",
      "names": {
        "zh": "4号线",
        "en": "Line 4"
      },
      "aliases": [],
      "mode": "metro",
      "status": "operating",
      "loop": false,
      "color": "#0072ce",
      "short_name": "4",
      "source_ids": [
        {
          "source": "sz-mtr-map-js",
          "id": "4"
        }
      ],
      "extras": {
        "source_line_index": 5,
        "names_source": "source",
        "is_extension_corridor": false
      }
    },
    {
      "id": "cn-suzhou-line-5",
      "name": "5号线",
      "names": {
        "zh": "5号线",
        "en": "Line 5"
      },
      "aliases": [],
      "mode": "metro",
      "status": "operating",
      "loop": false,
      "color": "#e93cac",
      "short_name": "5",
      "source_ids": [
        {
          "source": "sz-mtr-map-js",
          "id": "5"
        }
      ],
      "extras": {
        "source_line_index": 6,
        "names_source": "source",
        "is_extension_corridor": false
      }
    },
    {
      "id": "cn-suzhou-line-6",
      "name": "6号线",
      "names": {
        "zh": "6号线",
        "en": "Line 6"
      },
      "aliases": [],
      "mode": "metro",
      "status": "operating",
      "loop": false,
      "color": "#41b6e6",
      "short_name": "6",
      "source_ids": [
        {
          "source": "sz-mtr-map-js",
          "id": "6"
        }
      ],
      "extras": {
        "source_line_index": 7,
        "names_source": "source",
        "is_extension_corridor": false
      }
    },
    {
      "id": "cn-suzhou-line-7",
      "name": "7号线",
      "names": {
        "zh": "7号线",
        "en": "Line 7"
      },
      "aliases": [],
      "mode": "metro",
      "status": "operating",
      "loop": false,
      "color": "#a77bca",
      "short_name": "7",
      "source_ids": [
        {
          "source": "sz-mtr-map-js",
          "id": "7"
        }
      ],
      "extras": {
        "source_line_index": 8,
        "names_source": "source",
        "is_extension_corridor": false
      }
    },
    {
      "id": "cn-suzhou-line-8",
      "name": "8号线",
      "names": {
        "zh": "8号线",
        "en": "Line 8"
      },
      "aliases": [],
      "mode": "metro",
      "status": "operating",
      "loop": false,
      "color": "#a09200",
      "short_name": "8",
      "source_ids": [
        {
          "source": "sz-mtr-map-js",
          "id": "8"
        }
      ],
      "extras": {
        "source_line_index": 1,
        "names_source": "source",
        "is_extension_corridor": false
      }
    },
    {
      "id": "cn-suzhou-line-hykf",
      "name": "6延线",
      "names": {
        "zh": "6延线",
        "en": "Line 6 Extension"
      },
      "aliases": [],
      "mode": "metro",
      "status": "under_construction",
      "loop": false,
      "short_name": "6延线",
      "source_ids": [
        {
          "source": "sz-mtr-map-js",
          "id": "9"
        }
      ],
      "extras": {
        "source_line_index": 10,
        "names_source": "source",
        "parent_line_no": "6",
        "is_extension_corridor": true,
        "parent_line_id": "cn-suzhou-line-6",
        "extension_pattern_id": "cn-suzhou-line-6-pattern-ext-hykf",
        "connector_stop_id": "cn-suzhou-sangtiandao-6",
        "stops_owned": 0
      }
    },
    {
      "id": "cn-suzhou-line-hzb4",
      "name": "7延线",
      "names": {
        "zh": "7延线",
        "en": "Line 7 Extension"
      },
      "aliases": [],
      "mode": "metro",
      "status": "under_construction",
      "loop": false,
      "short_name": "7延线",
      "source_ids": [
        {
          "source": "sz-mtr-map-js",
          "id": "12"
        }
      ],
      "extras": {
        "source_line_index": 11,
        "names_source": "source",
        "parent_line_no": "7",
        "is_extension_corridor": true,
        "parent_line_id": "cn-suzhou-line-7",
        "extension_pattern_id": "cn-suzhou-line-7-pattern-ext-hzb4",
        "connector_stop_id": "cn-suzhou-changlou-7",
        "stops_owned": 0
      }
    }
  ]
}