{
  "$schema": "https://raw.githubusercontent.com/Naptie/openmetro/main/schemas/v1/lines.schema.json",
  "schema_version": "1.0",
  "network_id": "cn-changsha",
  "generated_at": "2026-10-23T13:01:40.311Z",
  "source": [],
  "records": [
    {
      "id": "cn-changsha-line-1",
      "name": "1号线",
      "names": {
        "zh": "1号线",
        "en": "Line 1"
      },
      "aliases": [],
      "color": "#cc0000",
      "short_name": "1",
      "mode": "metro",
      "status": "operating",
      "loop": false,
      "source_ids": [
        {
          "source": "hncsmtr-creatorcms",
          "id": "d28aa9109e1540f7ad4ee42e4cbdc613"
        },
        {
          "source": "amap-subway-4301",
          "id": "430100020925|430100020926"
        }
      ],
      "extras": {
        "official_line_id": "d28aa9109e1540f7ad4ee42e4cbdc613",
        "official_line_code": 1,
        "official_start_name": "金盆丘(铜官窑巴士站)",
        "official_end_name": "尚双塘",
        "station_count": 25,
        "amap_color": "CC0000",
        "baidu_name_hint": "轨道交通1号线"
      }
    },
    {
      "id": "cn-changsha-line-2",
      "name": "2号线",
      "names": {
        "zh": "2号线",
        "en": "Line 2"
      },
      "aliases": [],
      "color": "#52a8c9",
      "short_name": "2",
      "mode": "metro",
      "status": "operating",
      "loop": false,
      "source_ids": [
        {
          "source": "hncsmtr-creatorcms",
          "id": "e4563f4c920f44d2ac4f38e34586a0af"
        },
        {
          "source": "amap-subway-4301",
          "id": "430100020927|430100020928"
        }
      ],
      "extras": {
        "official_line_id": "e4563f4c920f44d2ac4f38e34586a0af",
        "official_line_code": 2,
        "official_start_name": "光达",
        "official_end_name": "梅溪湖西",
        "station_count": 23,
        "amap_color": "52A8C9",
        "baidu_name_hint": "轨道交通2号线"
      }
    },
    {
      "id": "cn-changsha-line-3",
      "name": "3号线",
      "names": {
        "zh": "3号线",
        "en": "Line 3"
      },
      "aliases": [],
      "color": "#86b81c",
      "short_name": "3",
      "mode": "metro",
      "status": "operating",
      "loop": false,
      "source_ids": [
        {
          "source": "hncsmtr-creatorcms",
          "id": "4f7c68735e254f5b9c1462ecb7f3142c"
        },
        {
          "source": "amap-subway-4301",
          "id": "900000065929|900000065956"
        }
      ],
      "extras": {
        "official_line_id": "4f7c68735e254f5b9c1462ecb7f3142c",
        "official_line_code": 3,
        "official_start_name": "长沙方向（广生）",
        "official_end_name": "湘潭方向（红桥/湘潭北站）",
        "station_count": 33,
        "amap_color": "86B81C",
        "baidu_name_hint": "轨道交通3号线"
      }
    },
    {
      "id": "cn-changsha-line-4",
      "name": "4号线",
      "names": {
        "zh": "4号线",
        "en": "Line 4"
      },
      "aliases": [],
      "color": "#d10195",
      "short_name": "4",
      "mode": "metro",
      "status": "operating",
      "loop": false,
      "source_ids": [
        {
          "source": "hncsmtr-creatorcms",
          "id": "d8ad45f4dfe34f01949ac946433daec5"
        },
        {
          "source": "amap-subway-4301",
          "id": "900000066167|900000066174"
        }
      ],
      "extras": {
        "official_line_id": "d8ad45f4dfe34f01949ac946433daec5",
        "official_line_code": 4,
        "official_start_name": "罐子岭",
        "official_end_name": "杜家坪",
        "station_count": 25,
        "amap_color": "D10195",
        "baidu_name_hint": "轨道交通4号线"
      }
    },
    {
      "id": "cn-changsha-line-5",
      "name": "5号线",
      "names": {
        "zh": "5号线",
        "en": "Line 5"
      },
      "aliases": [],
      "color": "#fcd600",
      "short_name": "5",
      "mode": "metro",
      "status": "operating",
      "loop": false,
      "source_ids": [
        {
          "source": "hncsmtr-creatorcms",
          "id": "98642f513cf14562ba83d96a2c2fde80"
        },
        {
          "source": "amap-subway-4301",
          "id": "900000066175|900000066200"
        }
      ],
      "extras": {
        "official_line_id": "98642f513cf14562ba83d96a2c2fde80",
        "official_line_code": 5,
        "official_start_name": "毛竹塘",
        "official_end_name": "水渡河",
        "station_count": 18,
        "amap_color": "FCD600",
        "baidu_name_hint": "轨道交通5号线"
      }
    },
    {
      "id": "cn-changsha-line-6",
      "name": "6号线",
      "names": {
        "zh": "6号线",
        "en": "Line 6"
      },
      "aliases": [],
      "color": "#0065b3",
      "short_name": "6",
      "mode": "metro",
      "status": "operating",
      "loop": false,
      "source_ids": [
        {
          "source": "hncsmtr-creatorcms",
          "id": "0ca28e42bfc548228d259f9a9a4e40b6"
        },
        {
          "source": "amap-subway-4301",
          "id": "900000075109|900000075110"
        }
      ],
      "extras": {
        "official_line_id": "0ca28e42bfc548228d259f9a9a4e40b6",
        "official_line_code": 6,
        "official_start_name": "谢家桥",
        "official_end_name": "黄花机场T1T2",
        "station_count": 34,
        "amap_color": "0065B3",
        "baidu_name_hint": "轨道交通6号线"
      }
    },
    {
      "id": "cn-changsha-line-s2",
      "name": "磁浮快线",
      "names": {
        "zh": "磁浮快线",
        "en": "S2"
      },
      "aliases": [],
      "color": "#eb81b9",
      "short_name": "S2",
      "mode": "light_rail",
      "status": "operating",
      "loop": false,
      "source_ids": [
        {
          "source": "hncsmtr-creatorcms",
          "id": "efb09986c7d04e9a92abf57379d2d2cb"
        },
        {
          "source": "amap-subway-4301",
          "id": "900000057211|900000057212"
        }
      ],
      "extras": {
        "official_line_id": "efb09986c7d04e9a92abf57379d2d2cb",
        "official_line_code": 7,
        "official_start_name": "磁浮高铁站",
        "official_end_name": "磁浮机场站",
        "station_count": 3,
        "amap_color": "EB81B9",
        "baidu_name_hint": "磁浮快线"
      }
    }
  ]
}