{
  "$schema": "https://raw.githubusercontent.com/Naptie/openmetro/main/schemas/v1/lines.schema.json",
  "schema_version": "1.0",
  "network_id": "cn-harbin",
  "generated_at": "2026-10-22T14:36:34.728Z",
  "source": [],
  "records": [
    {
      "id": "cn-harbin-line-1",
      "name": "1号线",
      "names": {
        "zh": "1号线",
        "en": "Line 1"
      },
      "aliases": [
        "地铁1号线"
      ],
      "color": "#fc0601",
      "short_name": "1",
      "mode": "metro",
      "status": "operating",
      "loop": false,
      "source_ids": [
        {
          "source": "amap-subway-2301",
          "id": "1号线"
        }
      ],
      "extras": {
        "names_source": "source",
        "amap_color": "FC0601",
        "amap_name": "1号线",
        "baidu_vehicle_name": "地铁1号线",
        "service_note": "常规运行图 06:00–22:30（各站首班约 05:30 起，末班 22:30–23:26）；法定节假日与大型活动期间运营方将末班延至 23:00（临时调整，规划器数据为常规图，未固化）",
        "fare_policy": "mileage"
      }
    },
    {
      "id": "cn-harbin-line-2",
      "name": "2号线",
      "names": {
        "zh": "2号线",
        "en": "Line 2"
      },
      "aliases": [
        "地铁2号线"
      ],
      "color": "#00ab4f",
      "short_name": "2",
      "mode": "metro",
      "status": "operating",
      "loop": false,
      "source_ids": [
        {
          "source": "amap-subway-2301",
          "id": "2号线"
        }
      ],
      "extras": {
        "names_source": "source",
        "amap_color": "00AB4F",
        "amap_name": "2号线",
        "baidu_vehicle_name": "地铁2号线",
        "service_note": "常规运行图 06:00–22:30（各站首班约 05:30 起，末班 22:30–23:26）；法定节假日与大型活动期间运营方将末班延至 23:00（临时调整，规划器数据为常规图，未固化）",
        "fare_policy": "mileage"
      }
    },
    {
      "id": "cn-harbin-line-3",
      "name": "3号线",
      "names": {
        "zh": "3号线",
        "en": "Line 3"
      },
      "aliases": [
        "地铁3号线"
      ],
      "color": "#ffa500",
      "short_name": "3",
      "mode": "metro",
      "status": "operating",
      "loop": true,
      "source_ids": [
        {
          "source": "amap-subway-2301",
          "id": "3号线"
        }
      ],
      "extras": {
        "names_source": "source",
        "amap_color": "FFA500",
        "amap_name": "3号线",
        "baidu_vehicle_name": "地铁3号线",
        "service_note": "常规运行图 06:00–22:30（各站首班约 05:30 起，末班 22:30–23:26）；法定节假日与大型活动期间运营方将末班延至 23:00（临时调整，规划器数据为常规图，未固化）",
        "fare_policy": "mileage"
      }
    }
  ]
}