{
  "$schema": "https://raw.githubusercontent.com/Naptie/openmetro/main/schemas/v1/lines.schema.json",
  "schema_version": "1.0",
  "network_id": "cn-dalian",
  "generated_at": "2026-10-22T14:18:10.311Z",
  "source": [],
  "records": [
    {
      "id": "cn-dalian-line-1",
      "name": "1号线",
      "names": {
        "zh": "1号线",
        "en": "Line 1"
      },
      "aliases": [],
      "color": "#018237",
      "short_name": "1",
      "mode": "metro",
      "status": "operating",
      "loop": false,
      "source_ids": [
        {
          "source": "amap-subway-2102",
          "id": "1号线"
        }
      ],
      "extras": {
        "names_source": "source",
        "amap_color": "018237",
        "amap_name": "1号线",
        "baidu_vehicle_name": "地铁1号线",
        "note": "姚家—河口，6B 编组，设桧柏路车辆段与蔡大岭停车场。"
      }
    },
    {
      "id": "cn-dalian-line-12",
      "name": "12号线",
      "names": {
        "zh": "12号线",
        "en": "Line 12"
      },
      "aliases": [
        "202路轨道延伸线"
      ],
      "color": "#5a2b8d",
      "short_name": "12",
      "mode": "metro",
      "status": "operating",
      "loop": false,
      "source_ids": [
        {
          "source": "amap-subway-2102",
          "id": "12号线"
        }
      ],
      "extras": {
        "names_source": "source",
        "amap_color": "5A2B8D",
        "amap_name": "12号线",
        "baidu_vehicle_name": "地铁12号线",
        "note": "河口—旅顺新港，4B 编组，由原 202 路电车延伸线改建，设铁山车辆段。"
      }
    },
    {
      "id": "cn-dalian-line-13",
      "name": "13号线",
      "names": {
        "zh": "13号线",
        "en": "Line 13"
      },
      "aliases": [
        "金普城际铁路"
      ],
      "color": "#fcd600",
      "short_name": "13",
      "mode": "suburban_rail",
      "status": "operating",
      "loop": false,
      "source_ids": [
        {
          "source": "amap-subway-2102",
          "id": "13号线"
        }
      ],
      "extras": {
        "names_source": "source",
        "amap_color": "FCD600",
        "amap_name": "13号线",
        "baidu_vehicle_name": "地铁13号线",
        "note": "工程名金普城际铁路，市域快轨制式，4B 编组，最高运行速度 120km/h。采用大小交路：大交路 普兰店振兴街↔开发区（间隔 30 分钟），小交路 九里↔开发区；与3号线九里支线贯通运营。"
      }
    },
    {
      "id": "cn-dalian-line-2",
      "name": "2号线",
      "names": {
        "zh": "2号线",
        "en": "Line 2"
      },
      "aliases": [],
      "color": "#01a2e2",
      "short_name": "2",
      "mode": "metro",
      "status": "operating",
      "loop": false,
      "source_ids": [
        {
          "source": "amap-subway-2102",
          "id": "2号线"
        }
      ],
      "extras": {
        "names_source": "source",
        "amap_color": "01A2E2",
        "amap_name": "2号线",
        "baidu_vehicle_name": "地铁2号线",
        "note": "大连北站—海之韵，6B 编组，设虹锦路车辆段（与1号线共用控制中心）。"
      }
    },
    {
      "id": "cn-dalian-line-3",
      "name": "3号线",
      "names": {
        "zh": "3号线",
        "en": "Line 3"
      },
      "aliases": [
        "快轨3号线"
      ],
      "color": "#f0087d",
      "short_name": "3",
      "mode": "metro",
      "status": "operating",
      "loop": false,
      "source_ids": [
        {
          "source": "amap-subway-2102",
          "id": "3号线"
        },
        {
          "source": "amap-subway-2102",
          "id": "地铁3号线支线"
        }
      ],
      "extras": {
        "names_source": "source",
        "amap_color": "F0087D",
        "amap_name": "3号线",
        "baidu_vehicle_name": "地铁3号线",
        "note": "主线 大连站—金石滩（4B 编组，点式 ATP）。保税区小交路 大连站⇌保税区 与主线并存；九里支线（快轨九里支线，2B 编组）自开发区站分岔，2021-12-28 起与13号线一期贯通运营至普兰店振兴街。"
      }
    },
    {
      "id": "cn-dalian-line-5",
      "name": "5号线",
      "names": {
        "zh": "5号线",
        "en": "Line 5"
      },
      "aliases": [],
      "color": "#fc0601",
      "short_name": "5",
      "mode": "metro",
      "status": "operating",
      "loop": false,
      "source_ids": [
        {
          "source": "amap-subway-2102",
          "id": "5号线"
        }
      ],
      "extras": {
        "names_source": "source",
        "amap_color": "FC0601",
        "amap_name": "5号线",
        "baidu_vehicle_name": "地铁5号线",
        "note": "后关—虎滩新区，6B 编组，中国东北地区首条跨海地铁线路。"
      }
    }
  ]
}