{
  "$schema": "https://raw.githubusercontent.com/Naptie/openmetro/main/schemas/v1/lines.schema.json",
  "schema_version": "1.0",
  "network_id": "cn-kaohsiung",
  "generated_at": "2026-10-15T10:13:52.158Z",
  "source": [
    {
      "name": "krtc-stations",
      "url": "https://www.krtc.com.tw/Guide/station_guide",
      "version": "live",
      "retrieved_at": "2026-10-15T10:13:52.153Z",
      "license": "unknown",
      "license_url": null,
      "attribution": "高雄捷運股份有限公司；官方車站導覽、首末班車、站間行駛時間及單程票票價查詢。",
      "notes": "Planner results use a 24-hour scratch cache. Cross-system fares are unavailable."
    },
    {
      "name": "krtc-lrt-stations",
      "url": "https://www.krtc.com.tw/KLRT/station_guide",
      "version": "live",
      "retrieved_at": "2026-10-15T10:13:52.153Z",
      "license": "unknown",
      "license_url": null,
      "attribution": "高雄捷運股份有限公司；官方車站導覽、首末班車、站間行駛時間及單程票票價查詢。",
      "notes": "Planner results use a 24-hour scratch cache. Cross-system fares are unavailable."
    },
    {
      "name": "krtc-timetables",
      "url": "https://www.krtc.com.tw/Guide/first_and_last_train",
      "version": "live",
      "retrieved_at": "2026-10-15T10:13:52.153Z",
      "license": "unknown",
      "license_url": null,
      "attribution": "高雄捷運股份有限公司；官方車站導覽、首末班車、站間行駛時間及單程票票價查詢。",
      "notes": "Planner results use a 24-hour scratch cache. Cross-system fares are unavailable."
    },
    {
      "name": "krtc-lrt-timetables",
      "url": "https://www.krtc.com.tw/KLRT/first_and_last_train",
      "version": "live",
      "retrieved_at": "2026-10-15T10:13:52.153Z",
      "license": "unknown",
      "license_url": null,
      "attribution": "高雄捷運股份有限公司；官方車站導覽、首末班車、站間行駛時間及單程票票價查詢。",
      "notes": "Planner results use a 24-hour scratch cache. Cross-system fares are unavailable."
    },
    {
      "name": "krtc-lrt-travel-matrix",
      "url": "https://www.krtc.com.tw/KLRT/time_between_train",
      "version": "live",
      "retrieved_at": "2026-10-15T10:13:52.153Z",
      "license": "unknown",
      "license_url": null,
      "attribution": "高雄捷運股份有限公司；官方車站導覽、首末班車、站間行駛時間及單程票票價查詢。",
      "notes": "Planner results use a 24-hour scratch cache. Cross-system fares are unavailable."
    },
    {
      "name": "krtc-planner",
      "url": "https://www.krtc.com.tw",
      "version": "live",
      "retrieved_at": "2026-10-15T10:13:52.153Z",
      "license": "unknown",
      "license_url": null,
      "attribution": "高雄捷運股份有限公司；官方車站導覽、首末班車、站間行駛時間及單程票票價查詢。",
      "notes": "Planner results use a 24-hour scratch cache. Cross-system fares are unavailable."
    },
    {
      "name": "photon-osm",
      "url": "https://photon.komoot.io/api/",
      "version": "live",
      "retrieved_at": "2026-10-15T10:13:52.153Z",
      "license": "odbl",
      "license_url": "https://www.openstreetmap.org/copyright",
      "attribution": "© OpenStreetMap contributors; geocoding by Photon / komoot.",
      "notes": "Photon candidates verified through OSM API by official ref, mode, operator/network and city bounds; coordinates are derived."
    },
    {
      "name": "osm-identity",
      "url": "https://api.openstreetmap.org/api/0.6/",
      "version": "live",
      "retrieved_at": "2026-10-15T10:13:52.153Z",
      "license": "odbl",
      "license_url": "https://www.openstreetmap.org/copyright",
      "attribution": "© OpenStreetMap contributors; geocoding by Photon / komoot.",
      "notes": "Photon candidates verified through OSM API by official ref, mode, operator/network and city bounds; coordinates are derived."
    }
  ],
  "records": [
    {
      "id": "cn-kaohsiung-line-c",
      "name": "環狀輕軌",
      "names": {
        "zh": "環狀輕軌",
        "en": "Circular Light Rail"
      },
      "aliases": [],
      "short_name": "C",
      "color": "#66AA33",
      "mode": "light_rail",
      "status": "operating",
      "loop": true,
      "extras": {
        "timetable_coverage": "all_stop_directions"
      },
      "source_ids": [
        {
          "source": "krtc-stations",
          "id": "C"
        }
      ]
    },
    {
      "id": "cn-kaohsiung-line-o",
      "name": "橘線",
      "names": {
        "zh": "橘線",
        "en": "Orange Line"
      },
      "aliases": [],
      "short_name": "O",
      "color": "#FAA73F",
      "mode": "metro",
      "status": "operating",
      "loop": false,
      "extras": {
        "timetable_coverage": "all_stop_directions"
      },
      "source_ids": [
        {
          "source": "krtc-stations",
          "id": "O"
        }
      ]
    },
    {
      "id": "cn-kaohsiung-line-r",
      "name": "紅線",
      "names": {
        "zh": "紅線",
        "en": "Red Line"
      },
      "aliases": [],
      "short_name": "R",
      "color": "#E20B65",
      "mode": "metro",
      "status": "operating",
      "loop": false,
      "extras": {
        "timetable_coverage": "all_stop_directions"
      },
      "source_ids": [
        {
          "source": "krtc-stations",
          "id": "R"
        }
      ]
    }
  ]
}