{
  "$schema": "https://raw.githubusercontent.com/Naptie/openmetro/main/schemas/v1/lines.schema.json",
  "schema_version": "1.0",
  "network_id": "cn-xuzhou",
  "generated_at": "2026-10-23T21:30:23.589Z",
  "source": [],
  "records": [
    {
      "id": "cn-xuzhou-line-1",
      "name": "1号线",
      "names": {
        "zh": "1号线",
        "en": "Line 1"
      },
      "aliases": [],
      "color": "#cc0000",
      "short_name": "1",
      "mode": "metro",
      "status": "operating",
      "loop": false,
      "source_ids": [
        {
          "source": "xzdtjt-dropbox",
          "id": "1"
        },
        {
          "source": "amap-subway-3203",
          "id": "900000049063|900000049064"
        }
      ],
      "extras": {
        "official_line_number": 1,
        "planner_line_index": 0,
        "baidu_name_hint": "地铁1号线",
        "amap_color": "CC0000"
      }
    },
    {
      "id": "cn-xuzhou-line-2",
      "name": "2号线",
      "names": {
        "zh": "2号线",
        "en": "Line 2"
      },
      "aliases": [],
      "color": "#ee782e",
      "short_name": "2",
      "mode": "metro",
      "status": "operating",
      "loop": false,
      "source_ids": [
        {
          "source": "xzdtjt-dropbox",
          "id": "2"
        },
        {
          "source": "amap-subway-3203",
          "id": "900000065741|900000065742"
        }
      ],
      "extras": {
        "official_line_number": 2,
        "planner_line_index": 1,
        "baidu_name_hint": "地铁2号线",
        "amap_color": "EE782E"
      }
    },
    {
      "id": "cn-xuzhou-line-3",
      "name": "3号线",
      "names": {
        "zh": "3号线",
        "en": "Line 3"
      },
      "aliases": [],
      "color": "#3080b7",
      "short_name": "3",
      "mode": "metro",
      "status": "operating",
      "loop": false,
      "source_ids": [
        {
          "source": "xzdtjt-dropbox",
          "id": "3"
        },
        {
          "source": "amap-subway-3203",
          "id": "900000065739|900000065740"
        }
      ],
      "extras": {
        "official_line_number": 3,
        "planner_line_index": 2,
        "baidu_name_hint": "地铁3号线",
        "amap_color": "3080B7"
      }
    },
    {
      "id": "cn-xuzhou-line-6",
      "name": "6号线",
      "names": {
        "zh": "6号线",
        "en": "Line 6"
      },
      "aliases": [],
      "color": "#793e8c",
      "short_name": "6",
      "mode": "metro",
      "status": "operating",
      "loop": false,
      "source_ids": [
        {
          "source": "xzdtjt-dropbox",
          "id": "6"
        },
        {
          "source": "amap-subway-3203",
          "id": "900000154271|900000154272"
        }
      ],
      "extras": {
        "official_line_number": 6,
        "planner_line_index": 3,
        "baidu_name_hint": "地铁6号线",
        "amap_color": "793E8C"
      }
    }
  ]
}