{
  "$schema": "https://raw.githubusercontent.com/Naptie/openmetro/main/schemas/v1/lines.schema.json",
  "schema_version": "1.0",
  "network_id": "cn-wuxi",
  "generated_at": "2026-10-23T21:34:54.677Z",
  "source": [],
  "records": [
    {
      "id": "cn-wuxi-line-1",
      "name": "1号线",
      "names": {
        "zh": "1号线",
        "en": "Line 1"
      },
      "aliases": [],
      "color": "#ee3f42",
      "short_name": "1",
      "mode": "metro",
      "status": "operating",
      "loop": false,
      "source_ids": [
        {
          "source": "amap-subway-3202",
          "id": "1号线"
        }
      ],
      "extras": {
        "line_short_name": "1",
        "official_line_color": "EE3F42",
        "baidu_name_hint": "地铁1号线"
      }
    },
    {
      "id": "cn-wuxi-line-2",
      "name": "2号线",
      "names": {
        "zh": "2号线",
        "en": "Line 2"
      },
      "aliases": [],
      "color": "#00ab4f",
      "short_name": "2",
      "mode": "metro",
      "status": "operating",
      "loop": false,
      "source_ids": [
        {
          "source": "amap-subway-3202",
          "id": "2号线"
        }
      ],
      "extras": {
        "line_short_name": "2",
        "official_line_color": "00AB4F",
        "baidu_name_hint": "地铁2号线"
      }
    },
    {
      "id": "cn-wuxi-line-3",
      "name": "3号线",
      "names": {
        "zh": "3号线",
        "en": "Line 3"
      },
      "aliases": [],
      "color": "#01a2e2",
      "short_name": "3",
      "mode": "metro",
      "status": "operating",
      "loop": false,
      "source_ids": [
        {
          "source": "amap-subway-3202",
          "id": "3号线"
        }
      ],
      "extras": {
        "line_short_name": "3",
        "official_line_color": "01A2E2",
        "baidu_name_hint": "地铁3号线"
      }
    },
    {
      "id": "cn-wuxi-line-4",
      "name": "4号线",
      "names": {
        "zh": "4号线",
        "en": "Line 4"
      },
      "aliases": [],
      "color": "#b93ff5",
      "short_name": "4",
      "mode": "metro",
      "status": "operating",
      "loop": false,
      "source_ids": [
        {
          "source": "amap-subway-3202",
          "id": "4号线"
        }
      ],
      "extras": {
        "line_short_name": "4",
        "official_line_color": "B93FF5",
        "baidu_name_hint": "地铁4号线"
      }
    },
    {
      "id": "cn-wuxi-line-s1",
      "name": "S1线",
      "names": {
        "zh": "S1线",
        "en": "S1/Xicheng Line"
      },
      "aliases": [],
      "color": "#ee3f42",
      "short_name": "S1",
      "mode": "suburban_rail",
      "status": "operating",
      "loop": false,
      "source_ids": [
        {
          "source": "amap-subway-3202",
          "id": "S1线"
        }
      ],
      "extras": {
        "line_short_name": "S1",
        "official_line_color": "EE3F42",
        "baidu_name_hint": "地铁S1号线"
      }
    }
  ]
}